BlueLayer,2022-01-01,"Berlin, Berlin, Germany",Berlin,Berlin,0,0,1,0,0,0,0,0,0,0,0,0,0,0,0,0,Software,Information Technology,0,1,0,0,0,0,0,0,0,0,0,0,0,11-50,2,"$5,600,000",Seed,2024-01-30,"$5,600,000",2.0,10.0,BlueLayer focuses on building software stacks for project developers producing carbon credits.,Software,BlueLayer Software startup website,0.0,0.0,2000.0,500.0,1,$,5600000.0,$,5600000.0,1.08,historical,1.08,6048000.0,6048000.0,3,24,2,information_technology,0.0,0.0,7.601402334583733,6.2166061010848646,15.615238362185409,2.3978952727983707,3.2188758248682006,1.3862943611198906
SEMRON,2020-01-01,"Dresden, Sachsen, Germany",Dresden,Sachsen,0,0,0,0,0,0,0,0,0,0,0,0,1,0,0,0,"3D Technology, AI,",Information Technology,0,1,0,0,0,0,0,0,0,0,0,0,0,1-10,3,"€7,300,000",Seed,2024-01-30,"€7,300,000",13.0,14.0,"SEMRON develops a 3D-scaled AI inference chip, based on a new proven semiconductor device.",3D Technology,SEMRON 3D Technology startup website,97.0,0.0,3000.0,500.0,1,€,7300000.0,€,7300000.0,1.08,historical,1.08,7300000.0,7300000.0,5,48,2,information_technology,4.584967478670572,0.0,8.006700845440367,6.2166061010848646,15.803385043104912,2.70805020110221,3.8918202981106265,1.791759469228055
Widgetbook,2022-01-01,"Paderborn, Nordrhein-Westfalen,",Paderborn,Nordrhein-Westfalen,0,0,0,0,0,0,0,0,0,1,0,0,0,0,0,0,Software,Information Technology,0,1,0,0,0,0,0,0,0,0,0,0,0,1-10,2,0.0,Pre-Seed,2024-02-01,0.0,10.0,0.0,Widgetbook is an open source collaboration platform for designers and developers,Software,Widgetbook Software startup website,0.0,0.0,2000.0,500.0,1,0.0,0.0,0.0,0.0,1.08,historical,1.08,0.0,0.0,3,25,1,information_technology,0.0,0.0,7.601402334583733,6.2166061010848646,0.0,0.0,3.258096538021482,1.3862943611198906
Sadaarah,2021-10-17,"Berlin, Berlin, Germany",Berlin,Berlin,0,0,1,0,0,0,0,0,0,0,0,0,0,0,0,0,"Business Intelligence, Cloud Data Services,,,",Information Technology,0,1,0,0,0,0,0,0,0,0,0,0,0,1-10,1,0.0,Seed,2024-02-01,0.0,0.0,0.0,"Software company developing easy, reliable, efficient and competitive on-premise and cloud-based data management products and solutions.",Business Intelligence,Sadaarah Business Intelligence startup website,0.0,0.0,1000.0,500.0,1,0.0,0.0,0.0,0.0,1.08,historical,1.08,0.0,0.0,3,27,2,information_technology,0.0,0.0,6.90875477931522,6.2166061010848646,0.0,0.0,3.332204510175204,1.3862943611198906
Libra,2023-01-01,"Berlin, Berlin, Germany",Berlin,Berlin,0,0,1,0,0,0,0,0,0,0,0,0,0,0,0,0,"AI, Legal Tech",Information Technology,0,1,0,0,0,0,0,0,0,0,0,0,0,1-10,1,0.0,Pre-Seed,2024-02-01,0.0,1.0,0.0,AI Sandbox for your law practice,AI,Libra AI startup website,268.0,0.0,1000.0,500.0,1,0.0,0.0,0.0,0.0,1.08,historical,1.08,0.0,0.0,2,13,1,information_technology,5.594711379601839,0.0,6.90875477931522,6.2166061010848646,0.0,0.0,2.6390573296152584,1.0986122886681098
WAY.so,2022-12-22,"Berlin, Berlin, Germany",Berlin,Berlin,0,0,1,0,0,0,0,0,0,0,0,0,0,0,0,0,"Hardware, Software",Information Technology,0,1,0,0,0,0,0,0,0,0,0,0,0,1-10,1,"€1,200,000",Pre-Seed,2024-02-01,"€1,200,000",16.0,0.0,"Saas, IT, Cybersecurity, HR, Compliance, Hardware",Hardware,WAY.so Hardware startup website,0.0,0.0,619.0,500.0,1,€,1200000.0,€,1200000.0,1.08,historical,1.08,1200000.0,1200000.0,2,13,1,information_technology,0.0,0.0,6.429719478039138,6.2166061010848646,13.997832948091215,0.0,2.6390573296152584,1.0986122886681098
freque,2021-03-22,"Potsdam, Brandenburg, Germany",Potsdam,Brandenburg,0,0,0,1,0,0,0,0,0,0,0,0,0,0,0,0,"Film, Music, Software",Communication Services,0,0,1,0,0,0,0,0,0,0,0,0,0,1-10,2,"€1,200,000",Pre-Seed,2024-02-01,0.0,1.0,3.0,Music Review For Filmmakers,Film,freque Film startup website,27.0,134.0,325.0,380.0,0,€,1200000.0,0.0,0.0,1.08,historical,1.08,1200000.0,0.0,3,34,1,communication_services,3.332204510175204,4.90527477843843,5.786897381366708,5.942799375126701,13.997832948091215,1.3862943611198906,3.5553480614894135,1.3862943611198906
SILX,2024-01-01,"Berlin, Berlin, Germany",Berlin,Berlin,0,0,1,0,0,0,0,0,0,0,0,0,0,0,0,0,"Recruiting, Software",Industrials,1,0,0,0,0,0,0,0,0,0,0,0,0,1-10,1,"$1,500,000",Pre-Seed,2024-02-03,"$1,500,000",1.0,0.0,"Simplifying Applications for All - A user-friendly platform revolutionizing the application process. Effortlessly create, manage, and review",Recruiting,SILX Recruiting startup website,13.0,0.0,8.0,50.0,0,$,1500000.0,$,1500000.0,1.08,historical,1.08,1620000.0,1620000.0,1,1,1,industrials,2.6390573296152584,0.0,2.1972245773362196,3.9318256327243257,14.297937324492327,0.0,0.6931471805599453,0.6931471805599453
Bavest,2021-01-01,"Frankfurt, Hessen, Germany",Frankfurt,Hessen,0,0,0,0,0,0,1,0,0,0,0,0,0,0,0,0,"AI, Big Data,,,,,,",Information Technology,0,1,0,0,0,0,0,0,0,0,0,0,0,1-10,2,"€1,400,000",Pre-Seed,2024-02-05,"€1,100,000",8.0,23.0,"Bavest's infrastructure enables access to financial data, alternative data and analyzes portfolios with AI.",AI,Bavest AI startup website,83.0,0.0,1000.0,500.0,1,€,1400000.0,€,1100000.0,1.08,historical,1.08,1400000.0,1100000.0,4,37,1,information_technology,4.430816798843313,0.0,6.90875477931522,6.2166061010848646,14.151983508870947,3.1780538303479458,3.6375861597263857,1.6094379124341003
Diligent,2023-01-01,"Berlin, Berlin, Germany",Berlin,Berlin,0,0,1,0,0,0,0,0,0,0,0,0,0,0,0,0,"AI, Industrial Automation,",Information Technology,0,1,0,0,0,0,0,0,0,0,0,0,0,1-10,1,"$500,000",Pre-Seed,2024-02-06,"$500,000",1.0,1.0,Diligent helps fintechs and banks to automate and strengthen risk and compliance operations with Large Language Models,AI,Diligent AI startup website,0.0,0.0,104000.0,500.0,1,$,500000.0,$,500000.0,1.07,historical,1.07,535000.0,535000.0,2,13,1,information_technology,0.0,0.0,11.552155793461898,6.2166061010848646,13.190023895035274,0.6931471805599453,2.6390573296152584,1.0986122886681098
Papayo,2024-01-01,"Munich, Bayern, Germany",Munich,Bayern,0,1,0,0,0,0,0,0,0,0,0,0,0,0,0,0,"AI, Human Resources,",Information Technology,0,1,0,0,0,0,0,0,0,0,0,0,0,1-10,1,"€100,000",Pre-Seed,2024-02-10,"€100,000",1.0,0.0,Papayo provides AI tools that help HR and recruitment teams boost productivity and improve work-life balance.,AI,Papayo AI startup website,0.0,0.0,315.0,459.0,0,€,100000.0,€,100000.0,1.08,historical,1.08,100000.0,100000.0,1,1,1,information_technology,0.0,0.0,5.755742213586912,6.131226489483141,11.51293546492023,0.0,0.6931471805599453,0.6931471805599453
Sempi,2024-01-01,"Berlin, Berlin, Germany",Berlin,Berlin,0,0,1,0,0,0,0,0,0,0,0,0,0,0,0,0,"Apps, E-Commerce, Information Technology",Information Technology,0,1,0,0,0,0,0,0,0,0,0,0,0,1-10,1,"€100,000",Pre-Seed,2024-02-10,"€100,000",1.0,0.0,"Sempi simplifies selling valuable items, handling descriptions, pricing, postings, and buyers.",Apps,Sempi Apps startup website,0.0,28.0,259.0,19.0,0,€,100000.0,€,100000.0,1.08,historical,1.08,100000.0,100000.0,1,1,1,information_technology,0.0,3.367295829986474,5.560681631015528,2.995732273553991,11.51293546492023,0.0,0.6931471805599453,0.6931471805599453
BiMA,2024-01-01,"Munich, Bayern, Germany",Munich,Bayern,0,1,0,0,0,0,0,0,0,0,0,0,0,0,0,0,"EdTech, Electronics, Reading Apps",Information Technology,0,1,0,0,0,0,0,0,0,0,0,0,0,0.0,1,"€100,000",Pre-Seed,2024-02-10,"€100,000",1.0,0.0,BiMA designs electronic devices and software aimed at enriching kids' reading.,EdTech,BiMA EdTech startup website,0.0,0.0,12000.0,500.0,1,€,100000.0,€,100000.0,1.08,historical,1.08,100000.0,100000.0,1,1,1,information_technology,0.0,0.0,9.392745258631441,6.2166061010848646,11.51293546492023,0.0,0.6931471805599453,0.6931471805599453
Plurality Network,2023-01-01,"Berlin, Berlin, Germany",Berlin,Berlin,0,0,1,0,0,0,0,0,0,0,0,0,0,0,0,0,"Blockchain, Information Technology,,,",Web3/Blockchain,0,0,0,0,0,0,1,0,0,0,0,0,0,1-10,1,"$100,000",Pre-Seed,2024-02-13,"$100,000",3.0,1.0,Plurality Network is a web3 company that focuses on personalizing user experiences through digital accounts.,Blockchain,Plurality Network Blockchain startup website,369.0,0.0,600.0,3198.0,1,$,100000.0,$,100000.0,1.08,historical,1.08,108000.0,108000.0,2,13,1,web3_blockchain,5.91350300563827,0.0,6.398594934535208,8.070593539949519,11.58989576532275,0.6931471805599453,2.6390573296152584,1.0986122886681098
Intentify,2022-01-01,"Cologne, Nordrhein-Westfalen,",Cologne,Nordrhein-Westfalen,0,0,0,0,0,0,0,0,0,1,0,0,0,0,0,0,"Software, Web Development",Information Technology,0,1,0,0,0,0,0,0,0,0,0,0,0,1-10,1,0.0,Pre-Seed,2024-02-14,0.0,3.0,0.0,Intentify is dApps' intent-centric middle layer.,Software,Intentify Software startup website,198.0,0.0,13000.0,500.0,1,0.0,0.0,0.0,0.0,1.07,historical,1.07,0.0,0.0,3,25,1,information_technology,5.293304824724492,0.0,9.472781556562168,6.2166061010848646,0.0,0.0,3.258096538021482,1.3862943611198906
simplyblock,2022-01-01,"Berlin, Berlin, Germany",Berlin,Berlin,0,0,1,0,0,0,0,0,0,0,0,0,0,0,0,0,"Cloud Computing, Cloud Data Services,,,,,,,,",Information Technology,0,1,0,0,0,0,0,0,0,0,0,0,0,1-10,2,"$3,302,275",Seed,2024-02-15,"$2,750,000",4.0,15.0,"Simplyblock develops low-latency high-performance storage software for IO-intensive workloads, Kubernetes, databases & applications.",Cloud Computing,simplyblock Cloud Computing startup website,128.0,0.0,7000.0,500.0,1,$,3302275.0,$,2750000.0,1.07,historical,1.07,3533434.25,2942500.0,3,25,2,information_technology,4.859812404361672,0.0,8.853808274977197,6.2166061010848646,15.077781114337819,2.772588722239781,3.258096538021482,1.3862943611198906
Una Health,2021-01-01,"Berlin, Berlin, Germany",Berlin,Berlin,0,0,1,0,0,0,0,0,0,0,0,0,0,0,0,0,"AI, Diabetes,,,",Information Technology,0,1,0,0,0,0,0,0,0,0,0,0,0,1-10,3,"$2,500,000",Seed,2024-02-15,"$2,500,000",6.0,1.0,"The most effective Digital Therapy to reverse metabolic dysfunction based on mobile technology, biosensors, AI and behavioral science.",AI,Una Health AI startup website,41.0,0.0,3000.0,500.0,1,$,2500000.0,$,2500000.0,1.07,historical,1.07,2675000.0,2675000.0,4,37,2,information_technology,3.7376696182833684,0.0,8.006700845440367,6.2166061010848646,14.79946031214395,0.6931471805599453,3.6375861597263857,1.6094379124341003
Flower Labs,2023-01-01,"Hamburg, Hamburg, Germany",Hamburg,Hamburg,0,0,0,0,0,1,0,0,0,0,0,0,0,0,0,0,"Machine Learning, Open Source,,",Information Technology,0,1,0,0,0,0,0,0,0,0,0,0,0,11-50,2,"$23,600,000",Series A,2024-02-15,"$20,000,000",9.0,19.0,"Flower is a federated learning, analytics, and evaluation platform.",Machine Learning,Flower Labs Machine Learning startup website,0.0,0.0,6000.0,500.0,1,$,23600000.0,$,20000000.0,1.07,historical,1.07,25252000.0,21400000.0,2,13,3,information_technology,0.0,0.0,8.699681400989514,6.2166061010848646,17.044415958070477,2.995732273553991,2.6390573296152584,1.0986122886681098
DataBorg,2020-01-01,"Hamburg, Hamburg, Germany",Hamburg,Hamburg,0,0,0,0,0,1,0,0,0,0,0,0,0,0,0,0,"Analytics, AI,,",Information Technology,0,1,0,0,0,0,0,0,0,0,0,0,0,1-10,2,"$550,000",Pre-Seed,2024-02-15,"$500,000",1.0,0.0,"DataBorg - Better Data, Smarter AIs. Foundation models turning unstructured data into structured data.",Analytics,DataBorg Analytics startup website,19.0,0.0,76.0,201.0,0,$,550000.0,$,500000.0,1.07,historical,1.07,588500.0,535000.0,5,49,1,information_technology,2.995732273553991,0.0,4.343805421853684,5.308267697401205,13.285333904916369,0.0,3.912023005428146,1.791759469228055
Globout,2023-01-01,"Berlin, Berlin, Germany",Berlin,Berlin,0,0,1,0,0,0,0,0,0,0,0,0,0,0,0,0,"Information Technology, Social Network,",Information Technology,0,1,0,0,0,0,0,0,0,0,0,0,0,1-10,2,"€100,000",Pre-Seed,2024-02-19,"€100,000",2.0,0.0,"Globout improves and multiplies real-world, in-person connections to combat social isolation and loneliness.",Information Technology,Globout Information Technology startup website,0.0,401.0,629.0,500.0,1,€,100000.0,€,100000.0,1.08,historical,1.08,100000.0,100000.0,2,13,1,information_technology,0.0,5.996452088619021,6.4457198193855785,6.2166061010848646,11.51293546492023,0.0,2.6390573296152584,1.0986122886681098
Monite,2020-01-01,"Berlin, Berlin, Germany",Berlin,Berlin,0,0,1,0,0,0,0,0,0,0,0,0,0,0,0,0,"Financial Services, FinTech, Payments,,",Financials,0,0,0,0,1,0,0,0,0,0,0,0,0,11-50,4,"$17,445,838",Seed,2024-02-19,"$6,000,000",25.0,52.0,Monite is an add invoicing and payables automation management platform.,Financial Services,Monite Financial Services startup website,110.0,0.0,15000.0,500.0,1,$,17445838.0,$,6000000.0,1.08,historical,1.08,18841505.040000003,6480000.0,5,49,2,financials,4.709530201312334,0.0,9.61587214452889,6.2166061010848646,16.75157276234646,3.970291913552122,3.912023005428146,1.791759469228055
Threedy,2020-10-15,"Darmstadt, Hessen, Germany",Darmstadt,Hessen,0,0,0,0,0,0,1,0,0,0,0,0,0,0,0,0,"3D Technology, Augmented Reality,,,,",Information Technology,0,1,0,0,0,0,0,0,0,0,0,0,0,51-100,2,"€11,400,000",Series A,2024-02-20,"€9,600,000",8.0,8.0,"Building on 25 years of research, Threedy’s visual computing pioneers are leading the development of our platform technology instant3Dhub.",3D Technology,Threedy 3D Technology startup website,51.0,0.0,2000.0,500.0,1,€,11400000.0,€,9600000.0,1.08,historical,1.08,11400000.0,9600000.0,4,40,3,information_technology,3.9512437185814275,0.0,7.601402334583733,6.2166061010848646,16.249124001084017,2.1972245773362196,3.713572066704308,1.6094379124341003
Embea,2022-01-01,"Berlin, Berlin, Germany",Berlin,Berlin,0,0,1,0,0,0,0,0,0,0,0,0,0,0,0,0,"Financial Services, Insurance,,",Financials,0,0,0,0,1,0,0,0,0,0,0,0,0,11-50,1,"€4,000,000",Seed,2024-02-20,"€4,000,000",6.0,6.0,Embea is an Embedded Insurance company for Life & Health,Financial Services,Embea Financial Services startup website,0.0,0.0,828.0,500.0,1,€,4000000.0,€,4000000.0,1.08,historical,1.08,4000000.0,4000000.0,3,25,2,financials,0.0,0.0,6.720220155135295,6.2166061010848646,15.201805169084134,1.9459101490553132,3.258096538021482,1.3862943611198906
xito.one,2020-01-01,"Ulm, Baden-Wurttemberg, Germany",Ulm,Baden-Wurttemberg,1,0,0,0,0,0,0,0,0,0,0,0,0,0,0,0,Robotics,Information Technology,0,1,0,0,0,0,0,0,0,0,0,0,0,11-50,2,"€1,600,000",Seed,2024-02-21,"€1,600,000",3.0,1.0,XITO is a manufacturer of the marketplace for automation through robotics.,Robotics,xito.one Robotics startup website,0.0,0.0,655.0,500.0,1,€,1600000.0,€,1600000.0,1.08,historical,1.08,1600000.0,1600000.0,5,49,2,information_technology,0.0,0.0,6.486160788944089,6.2166061010848646,14.285514812209815,0.6931471805599453,3.912023005428146,1.791759469228055
Acto,2021-01-01,"Paderborn, Nordrhein-Westfalen,",Paderborn,Nordrhein-Westfalen,0,0,0,0,0,0,0,0,0,1,0,0,0,0,0,0,"AI, B2B,,,",Information Technology,0,1,0,0,0,0,0,0,0,0,0,0,0,1-10,1,"€3,700,000",Seed,2024-02-22,"€3,700,000",6.0,0.0,Acto is an AI-based software that helps sales managers by syncing all sales data in one place and provides a customized data signal to CRM.,AI,Acto AI startup website,225.0,0.0,4000.0,500.0,1,€,3700000.0,€,3700000.0,1.08,historical,1.08,3700000.0,3700000.0,4,37,2,information_technology,5.420534999272286,0.0,8.294299608857235,6.2166061010848646,15.123843647884687,0.0,3.6375861597263857,1.6094379124341003
Octomind,2023-03-01,"Karlsruhe, Baden-Wurttemberg,",Karlsruhe,Baden-Wurttemberg,1,0,0,0,0,0,0,0,0,0,0,0,0,0,0,0,"AI, Software,,",Information Technology,0,1,0,0,0,0,0,0,0,0,0,0,0,1-10,1,"€4,500,000",Seed,2024-02-23,"€4,500,000",4.0,8.0,"Octomind is a developer tool using AI to make automated end-to-end testing stable, fast, and affordable.",AI,Octomind AI startup website,95.0,0.0,0.0,0.0,0,€,4500000.0,€,4500000.0,1.08,historical,1.08,4500000.0,4500000.0,1,11,2,information_technology,4.564348191467836,0.0,0.0,0.0,15.319588176962746,2.1972245773362196,2.4849066497880004,0.6931471805599453
Heyflow,2020-02-01,"Hamburg, Hamburg, Germany",Hamburg,Hamburg,0,0,0,0,0,1,0,0,0,0,0,0,0,0,0,0,Software,Information Technology,0,1,0,0,0,0,0,0,0,0,0,0,0,11-50,3,"$22,000,000",Series A,2024-02-23,"$16,000,000",5.0,17.0,Heyflow is a platform for interactive user experiences that requires no coding.,Software,Heyflow Software startup website,0.0,0.0,9000.0,500.0,1,$,22000000.0,$,16000000.0,1.08,historical,1.08,23760000.0,17280000.0,4,48,3,information_technology,0.0,0.0,9.105090961257085,6.2166061010848646,16.98351409454626,2.8903717578961645,3.8918202981106265,1.6094379124341003
Sunhat,2022-01-01,"Cologne, Nordrhein-Westfalen,",Cologne,Nordrhein-Westfalen,0,0,0,0,0,0,0,0,0,1,0,0,0,0,0,0,"Business Information Systems,,",Information Technology,0,1,0,0,0,0,0,0,0,0,0,0,0,11-50,2,"€5,000,000",Seed,2024-02-27,"€3,000,000",5.0,6.0,Sunhat is an automation tool that combines software engineering and sustainability expertise to help supply chain businesses.,Business Information Systems,Sunhat Business Information Systems startup website,2.0,26.0,2000.0,500.0,1,€,5000000.0,€,3000000.0,1.09,historical,1.09,5000000.0,3000000.0,3,25,2,information_technology,1.0986122886681098,3.295836866004329,7.601402334583733,6.2166061010848646,15.424948670398354,1.9459101490553132,3.258096538021482,1.3862943611198906
reteach,2020-03-25,"Berlin, Berlin, Germany",Berlin,Berlin,0,0,1,0,0,0,0,0,0,0,0,0,0,0,0,0,Software,Information Technology,0,1,0,0,0,0,0,0,0,0,0,0,0,1-10,1,"€1,500,000",Seed,2024-02-28,"€1,500,000",2.0,1.0,Reteach creates software and digital tools for online learning and training.,Software,reteach Software startup website,0.0,0.0,2000.0,500.0,1,€,1500000.0,€,1500000.0,1.08,historical,1.08,1500000.0,1500000.0,4,47,2,information_technology,0.0,0.0,7.601402334583733,6.2166061010848646,14.220976332738882,0.6931471805599453,3.871201010907891,1.6094379124341003
Yendou,2022-07-01,"Berlin, Berlin, Germany",Berlin,Berlin,0,0,1,0,0,0,0,0,0,0,0,0,0,0,0,0,"Clinical Trials, Information Technology,,",Health Care,0,0,0,0,0,0,0,1,0,0,0,0,0,1-10,1,"€1,200,000",Pre-Seed,2024-02-28,"€1,200,000",2.0,9.0,"We make it unbelievably easy, for clinical operations teams, to manage site selection activities for oncology clinical trials.",Clinical Trials,Yendou Clinical Trials startup website,0.0,0.0,2000.0,500.0,1,€,1200000.0,€,1200000.0,1.08,historical,1.08,1200000.0,1200000.0,2,19,1,health_care,0.0,0.0,7.601402334583733,6.2166061010848646,13.997832948091215,2.302585092994046,2.995732273553991,1.0986122886681098
Assemblio,2022-01-01,"Stuttgart, Baden-Wurttemberg,",Stuttgart,Baden-Wurttemberg,1,0,0,0,0,0,0,0,0,0,0,0,0,0,0,0,"AI, Industrial,,",Information Technology,0,1,0,0,0,0,0,0,0,0,0,0,0,11-50,1,"€2,100,000",Seed,2024-02-28,"€2,100,000",11.0,4.0,Assemblio offers an AI-based software solution for time- and cost-efficient assembly planning,AI,Assemblio AI startup website,0.0,0.0,4000.0,500.0,1,€,2100000.0,€,2100000.0,1.08,historical,1.08,2100000.0,2100000.0,3,25,2,information_technology,0.0,0.0,8.294299608857235,6.2166061010848646,14.557448378884015,1.6094379124341003,3.258096538021482,1.3862943611198906
ECEON Robotics,2022-01-01,"Cologne, Nordrhein-Westfalen,",Cologne,Nordrhein-Westfalen,0,0,0,0,0,0,0,0,0,1,0,0,0,0,0,0,"AI, Industrial Automation,,",Information Technology,0,1,0,0,0,0,0,0,0,0,0,0,0,11-50,1,0.0,Pre-Seed,2024-03-01,0.0,1.0,0.0,ECEON develops and operates next-generation autonomous mobile robots based on advanced artificial intelligence for intralogistics.,AI,ECEON Robotics AI startup website,0.0,0.0,202.0,469.0,0,0.0,0.0,0.0,0.0,1.08,historical,1.08,0.0,0.0,3,25,1,information_technology,0.0,0.0,5.313205979041787,6.152732694704104,0.0,0.0,3.258096538021482,1.3862943611198906
leonardo. impact,2023-02-16,"Frankfurt, Hessen, Germany",Frankfurt,Hessen,0,0,0,0,0,0,1,0,0,0,0,0,0,0,0,0,"Data Collection and Labeling, FinTech,,,,,",Other,0,0,0,0,0,0,0,0,0,0,1,0,0,1-10,2,"$1,604,367",Pre-Seed,2024-03-01,"$1,000,000",2.0,7.0,"AI-powered SaaS solution to streamline impact data collection, verification & reporting for impact investors and their portfolio companies.",Data Collection and Labeling,leonardo. impact Data Collection and Labeling startup website,0.0,0.0,1000.0,500.0,1,$,1604367.0,$,1000000.0,1.08,historical,1.08,1732716.36,1080000.0,1,12,1,other,0.0,0.0,6.90875477931522,6.2166061010848646,14.365201462494168,2.0794415416798357,2.5649493574615367,0.6931471805599453
Meaningful,2024-01-01,"Munich, Bayern, Germany",Munich,Bayern,0,1,0,0,0,0,0,0,0,0,0,0,0,0,0,0,"AI, Information Technology,,",Information Technology,0,1,0,0,0,0,0,0,0,0,0,0,0,1-10,1,"€100,000",Pre-Seed,2024-03-05,"€100,000",1.0,0.0,Supercharge your market research.,AI,Meaningful AI startup website,0.0,534.0,6000.0,500.0,1,€,100000.0,€,100000.0,1.09,historical,1.09,100000.0,100000.0,1,2,1,information_technology,0.0,6.282266746896006,8.699681400989514,6.2166061010848646,11.51293546492023,0.0,1.0986122886681098,0.6931471805599453
Deep Care,2020-01-01,"Ludwigsburg-eglosheim, Baden-Wurttemberg,",Ludwigsburg-eglosheim,Baden-Wurttemberg,1,0,0,0,0,0,0,0,0,0,0,0,0,0,0,0,"AI, Intelligent Systems,",Information Technology,0,1,0,0,0,0,0,0,0,0,0,0,0,11-50,2,0.0,Seed,2024-03-05,0.0,6.0,0.0,Deep Care is a seat behavior assistant that offers sitting behavior for office workers.,AI,Deep Care AI startup website,0.0,0.0,3000.0,500.0,1,0.0,0.0,0.0,0.0,1.09,historical,1.09,0.0,0.0,5,50,2,information_technology,0.0,0.0,8.006700845440367,6.2166061010848646,0.0,0.0,3.9318256327243257,1.791759469228055
Vilosia,2022-01-01,"Halle, Sachsen-Anhalt, Germany",Halle,Sachsen-Anhalt,0,0,0,0,0,0,0,0,0,0,0,0,0,1,0,0,"Generative AI, Information Technology,,",Information Technology,0,1,0,0,0,0,0,0,0,0,0,0,0,1-10,2,0.0,Pre-Seed,2024-03-10,0.0,0.0,0.0,Vilosia helps medium and large enterprises with internal development teams migrate legacy software systems.,Generative AI,Vilosia Generative AI startup website,0.0,0.0,134.0,71.0,0,0.0,0.0,0.0,0.0,1.09,historical,1.09,0.0,0.0,3,26,1,information_technology,0.0,0.0,4.90527477843843,4.276666119016055,0.0,0.0,3.295836866004329,1.3862943611198906
Frontnow,2020-01-01,"Berlin, Berlin, Germany",Berlin,Berlin,0,0,1,0,0,0,0,0,0,0,0,0,0,0,0,0,"AI, B2B,,,,",Information Technology,0,1,0,0,0,0,0,0,0,0,0,0,0,11-50,3,"€6,500,000",Seed,2024-03-12,"€3,800,000",6.0,14.0,Enterprise-Grade AI Supercharging Customer Experience,AI,Frontnow AI startup website,22.0,418.0,2000.0,500.0,1,€,6500000.0,€,3800000.0,1.09,historical,1.09,6500000.0,3800000.0,5,50,2,information_technology,3.1354942159291497,6.037870919922137,7.601402334583733,6.2166061010848646,15.687312888712007,2.70805020110221,3.9318256327243257,1.791759469228055
Autonomo Technologies,2021-05-25,"Hamburg, Hamburg, Germany",Hamburg,Hamburg,0,0,0,0,0,1,0,0,0,0,0,0,0,0,0,0,"AI, Computer Vision,,",Information Technology,0,1,0,0,0,0,0,0,0,0,0,0,0,11-50,2,"$4,519,159",Seed,2024-03-13,"€2,300,000",5.0,2.0,Autonomo Simplifies Shopping for Retailers and Customers,AI,Autonomo Technologies AI startup website,0.0,617.0,4000.0,500.0,1,$,4519159.0,€,2300000.0,1.09,historical,1.09,4925883.3100000005,2300000.0,3,33,2,information_technology,0.0,6.42648845745769,8.294299608857235,6.2166061010848646,15.410014371800147,1.0986122886681098,3.5263605246161616,1.3862943611198906
Tomorrow Things,2021-01-01,"Bonn, Nordrhein-Westfalen, Germany",Bonn,Nordrhein-Westfalen,0,0,0,0,0,0,0,0,0,1,0,0,0,0,0,0,"Business Development, SaaS,",Industrials,1,0,0,0,0,0,0,0,0,0,0,0,0,1-10,1,"€1,500,000",Seed,2024-03-13,"€1,500,000",9.0,0.0,Tomorrow Thing is an intelligent automation platform that makes digital twins of technological assets.,Business Development,Tomorrow Things Business Development startup website,0.0,0.0,824.0,500.0,1,€,1500000.0,€,1500000.0,1.09,historical,1.09,1500000.0,1500000.0,4,38,2,industrials,0.0,0.0,6.715383386334681,6.2166061010848646,14.220976332738882,0.0,3.6635616461296463,1.6094379124341003
Neotaste,2021-01-01,"Osnabrück, Niedersachsen, Germany",Osnabrück,Niedersachsen,0,0,0,0,0,0,0,0,1,0,0,0,0,0,0,0,"Apps, Internet, Search Engine,",Information Technology,0,1,0,0,0,0,0,0,0,0,0,0,0,11-50,2,"€21,000,000",Series A,2024-03-14,"€15,100,000",5.0,17.0,Neotaste is the developer of the restaurant-finding app that provides free marketing services for restaurateurs.,Apps,Neotaste Apps startup website,0.0,59000.0,5000.0,500.0,1,€,21000000.0,€,15100000.0,1.1,historical,1.1,21000000.0,15100000.0,4,38,3,information_technology,0.0,10.985309671896763,8.517393171418904,6.2166061010848646,16.860033043306743,2.8903717578961645,3.6635616461296463,1.6094379124341003
Interloom Technologies,2024-01-01,"München, Bayern, Germany",München,Bayern,0,1,0,0,0,0,0,0,0,0,0,0,0,0,0,0,"AI, Software",Information Technology,0,1,0,0,0,0,0,0,0,0,0,0,0,11-50,1,"$3,000,000",Seed,2024-03-14,"$3,000,000",1.0,1.0,Interloom Technologies redefines process automation for an AI future.,AI,Interloom Technologies AI startup website,45.0,0.0,818.0,500.0,1,$,3000000.0,$,3000000.0,1.1,historical,1.1,3300000.0000000005,3300000.0000000005,1,2,2,information_technology,3.828641396489095,0.0,6.70808408385307,6.2166061010848646,15.009433329466965,0.6931471805599453,1.0986122886681098,0.6931471805599453
Feniska,2021-01-01,"Berlin, Berlin, Germany",Berlin,Berlin,0,0,1,0,0,0,0,0,0,0,0,0,0,0,0,0,"Information Technology, Pet, Software",Information Technology,0,1,0,0,0,0,0,0,0,0,0,0,0,11-50,2,0.0,Pre-Seed,2024-03-17,0.0,1.0,0.0,Feniska is a software company that provides smart devices with an integrated app to monitor pet health.,Information Technology,Feniska Information Technology startup website,16.0,2077.0,1100.0,500.0,1,0.0,0.0,0.0,0.0,1.09,historical,1.09,0.0,0.0,4,38,1,information_technology,2.833213344056216,7.639161171659173,7.00397413672268,6.2166061010848646,0.0,0.0,3.6635616461296463,1.6094379124341003
