VYBE Beauty,2022-12-29,"Cologne, Nordrhein-Westfalen,",Cologne,Nordrhein-Westfalen,0,0,0,0,0,0,0,0,0,1,0,0,0,0,0,0,"AI, Beauty,,,,",Information Technology,0,1,0,0,0,0,0,0,0,0,0,0,0,1-10,1,0.0,Pre-Seed,2023-02-01,0.0,1.0,0.0,Developing and marketing the next generation of beauty consumer technologies.,AI,VYBE Beauty AI startup website,0.0,0.0,0.0,0.0,0,0.0,0.0,0.0,0.0,1.09,historical,1.09,0.0,0.0,2,1,1,information_technology,0.0,0.0,0.0,0.0,0.0,0.0,0.6931471805599453,1.0986122886681098
F-One,2021-04-24,"Frankfurt, Hessen, Germany",Frankfurt,Hessen,0,0,0,0,0,0,1,0,0,0,0,0,0,0,0,0,"AI, Robotic Process Automation (RPA)",Information Technology,0,1,0,0,0,0,0,0,0,0,0,0,0,1-10,1,"€200,000",Pre-Seed,2023-02-01,"€200,000",0.0,0.0,AI Freelancer that can be hired like a person to perform office routines.,AI,F-One AI startup website,0.0,0.0,0.0,500.0,1,€,200000.0,€,200000.0,1.09,historical,1.09,200000.0,200000.0,3,21,1,information_technology,0.0,0.0,0.0,6.2166061010848646,12.206077645517674,0.0,3.091042453358316,1.3862943611198906
FOMA,2022-02-01,"Hamburg, Hamburg, Germany",Hamburg,Hamburg,0,0,0,0,0,1,0,0,0,0,0,0,0,0,0,0,"Debt Collections, Embedded Systems,,",Financials,0,0,0,0,1,0,0,0,0,0,0,0,0,11-50,3,0.0,Seed,2023-02-06,0.0,2.0,2.0,FOMA is a German platform eco-system for the B2B credit management sector.,Debt Collections,FOMA Debt Collections startup website,0.0,0.0,769.0,500.0,1,0.0,0.0,0.0,0.0,1.08,historical,1.08,0.0,0.0,2,12,2,financials,0.0,0.0,6.646390514847729,6.2166061010848646,0.0,1.0986122886681098,2.5649493574615367,1.0986122886681098
Univents,2021-11-11,"Marbach Am Neckar, Baden-Wurttemberg,",Marbach Am Neckar,Baden-Wurttemberg,1,0,0,0,0,0,0,0,0,0,0,0,0,0,0,0,"Catering, Concerts, Event Management,,,,,,,",Consumer Discretionary,0,0,0,0,0,1,0,0,0,0,0,0,0,1-10,1,"€200,000",Pre-Seed,2023-02-12,"€200,000",0.0,0.0,Univents is a modern event technology SaaS that saves event managers half their time in event planning.,Catering,Univents Catering startup website,0.0,0.0,0.0,0.0,0,€,200000.0,€,200000.0,1.07,historical,1.07,200000.0,200000.0,3,15,1,consumer_discretionary,0.0,0.0,0.0,0.0,12.206077645517674,0.0,2.772588722239781,1.3862943611198906
Nefta,2021-12-01,"Berlin, Berlin, Germany",Berlin,Berlin,0,0,1,0,0,0,0,0,0,0,0,0,0,0,0,0,"Blockchain, Gaming, Information Technology,",Web3/Blockchain,0,0,0,0,0,0,1,0,0,0,0,0,0,11-50,2,"$6,000,000",Seed,2023-02-15,"$5,000,000",6.0,9.0,Nefta’s disruptive ad-network and pre-mediation solutions deliver superior revenue performance while rebuilding publisher trust in AdTech.,Blockchain,Nefta Blockchain startup website,522.0,0.0,1000.0,500.0,1,$,6000000.0,$,5000000.0,1.07,historical,1.07,6420000.0,5350000.0,3,14,2,web3_blockchain,6.259581464064923,0.0,6.90875477931522,6.2166061010848646,15.674928831429371,2.302585092994046,2.70805020110221,1.3862943611198906
Sovity,2021-10-01,"Dortmund, Nordrhein-Westfalen,",Dortmund,Nordrhein-Westfalen,0,0,0,0,0,0,0,0,0,1,0,0,0,0,0,0,"Big Data, Data Storage, SaaS, Software",Information Technology,0,1,0,0,0,0,0,0,0,0,0,0,0,11-50,2,0.0,Seed,2023-02-15,0.0,2.0,0.0,Sovity is a IDS operating company.,Big Data,Sovity Big Data startup website,0.0,0.0,2000.0,500.0,1,0.0,0.0,0.0,0.0,1.07,historical,1.07,0.0,0.0,3,16,2,information_technology,0.0,0.0,7.601402334583733,6.2166061010848646,0.0,0.0,2.833213344056216,1.3862943611198906
Knowunity,2020-01-01,"Sindelfingen, Baden-Wurttemberg,",Sindelfingen,Baden-Wurttemberg,1,0,0,0,0,0,0,0,0,0,0,0,0,0,0,0,"E-Learning, Education, Software",Consumer Discretionary,0,0,0,0,0,1,0,0,0,0,0,0,0,51-100,3,"€21,000,000",Series A,2023-02-15,"€9,000,000",13.0,3.0,"Knowunity is the digital learning platform with summaries, study notes, presentations, answers and more in one app.",E-Learning,Knowunity E-Learning startup website,0.0,3880.0,13000.0,500.0,1,€,21000000.0,€,9000000.0,1.07,historical,1.07,21000000.0,9000000.0,5,37,3,consumer_discretionary,0.0,8.263848131368906,9.472781556562168,6.2166061010848646,16.860033043306743,1.3862943611198906,3.6375861597263857,1.791759469228055
cre[ai]tion,2022-01-01,"Frankfort, Hessen, Germany",Frankfort,Hessen,0,0,0,0,0,0,1,0,0,0,0,0,0,0,0,0,"AI, Fashion,,",Information Technology,0,1,0,0,0,0,0,0,0,0,0,0,0,1-10,1,0.0,Pre-Seed,2023-02-15,0.0,1.0,0.0,creaitionis an interactive ai-based platform,AI,cre[ai]tion AI startup website,0.0,0.0,1000.0,500.0,1,0.0,0.0,0.0,0.0,1.07,historical,1.07,0.0,0.0,3,13,1,information_technology,0.0,0.0,6.90875477931522,6.2166061010848646,0.0,0.0,2.6390573296152584,1.3862943611198906
Kern AI,2020-11-17,"Eichwalde, Brandenburg, Germany",Eichwalde,Brandenburg,0,0,0,1,0,0,0,0,0,0,0,0,0,0,0,0,"AI, Software",Information Technology,0,1,0,0,0,0,0,0,0,0,0,0,0,1-10,1,"€2,700,000",Pre-Seed,2023-02-16,"€2,700,000",11.0,6.0,Kern AI is a data-centric platform to build natural language interfaces.,AI,Kern AI AI startup website,844.0,0.0,2000.0,500.0,1,€,2700000.0,€,2700000.0,1.07,historical,1.07,2700000.0,2700000.0,4,26,1,information_technology,6.739336627357174,0.0,7.601402334583733,6.2166061010848646,14.80876270134486,1.9459101490553132,3.295836866004329,1.6094379124341003
networkx,2022-07-05,"Frankfurt, Hessen, Germany",Frankfurt,Hessen,0,0,0,0,0,0,1,0,0,0,0,0,0,0,0,0,"AI, Boating,,,,,",Information Technology,0,1,0,0,0,0,0,0,0,0,0,0,0,11-50,1,"$610,000",Seed,2023-02-17,"$610,000",0.0,9.0,"networkx is an AI-based platform that prequalifies and matches innovators, visionaries, and changemakers with exclusive clubs worldwide.",AI,networkx AI startup website,0.0,2349.0,1000.0,500.0,1,$,610000.0,$,610000.0,1.07,historical,1.07,652700.0,652700.0,2,7,2,information_technology,0.0,7.762170607138205,6.90875477931522,6.2166061010848646,13.388874416719576,2.302585092994046,2.0794415416798357,1.0986122886681098
Phaseinvest,2023-01-01,"Berlin, Berlin, Germany",Berlin,Berlin,0,0,1,0,0,0,0,0,0,0,0,0,0,0,0,0,"Finance, Financial Services, FinTech,",Financials,0,0,0,0,1,0,0,0,0,0,0,0,0,1-10,1,"€20,000",Pre-Seed,2023-02-20,"€20,000",1.0,0.0,Phaseinvest is the developer of a financial platform designed to offer portfolio analysis services.,Finance,Phaseinvest Finance startup website,0.0,0.0,162.0,425.0,0,€,20000.0,€,20000.0,1.07,historical,1.07,20000.0,20000.0,2,1,1,financials,0.0,0.0,5.093750200806762,6.054439346269371,9.90353755128617,0.0,0.6931471805599453,1.0986122886681098
Green Fusion,2021-01-01,"Berlin, Berlin, Germany",Berlin,Berlin,0,0,1,0,0,0,0,0,0,0,0,0,0,0,0,0,"Energy Management, Software",Utilities,0,0,0,0,0,0,0,0,0,0,0,1,0,11-50,3,"€2,925,000",Seed,2023-02-21,"€2,700,000",7.0,1.0,Green Fusion develops a simple and secure software solution for more efficient control of your energy system.,Energy Management,Green Fusion Energy Management startup website,0.0,0.0,4000.0,500.0,1,€,2925000.0,€,2700000.0,1.07,historical,1.07,2925000.0,2700000.0,4,25,2,utilities,0.0,0.0,8.294299608857235,6.2166061010848646,14.888805380528378,0.6931471805599453,3.258096538021482,1.6094379124341003
eduBITES,2021-01-01,"Berlin, Berlin, Germany",Berlin,Berlin,0,0,1,0,0,0,0,0,0,0,0,0,0,0,0,0,"AI, Corporate Training,",Information Technology,0,1,0,0,0,0,0,0,0,0,0,0,0,1-10,1,"€2,100,000",Seed,2023-02-21,"€2,100,000",4.0,1.0,eduBITES is an online learning platform for organization.,AI,eduBITES AI startup website,0.0,0.0,1000.0,500.0,1,€,2100000.0,€,2100000.0,1.07,historical,1.07,2100000.0,2100000.0,4,25,2,information_technology,0.0,0.0,6.90875477931522,6.2166061010848646,14.557448378884015,0.6931471805599453,3.258096538021482,1.6094379124341003
READO,2020-06-01,"Frankfurt, Hessen, Germany",Frankfurt,Hessen,0,0,0,0,0,0,1,0,0,0,0,0,0,0,0,0,"AI, B2C,,,,,",Information Technology,0,1,0,0,0,0,0,0,0,0,0,0,0,11-50,2,"€640,000",Seed,2023-02-22,"€500,000",0.0,0.0,READO is the app to help readers find their next book.,AI,READO AI startup website,0.0,0.0,853.0,500.0,1,€,640000.0,€,500000.0,1.07,historical,1.07,640000.0,500000.0,4,32,2,information_technology,0.0,0.0,6.74993119378857,6.2166061010848646,13.369225017834633,0.0,3.4965075614664802,1.6094379124341003
Konfetti,2021-04-28,"Berlin, Berlin, Germany",Berlin,Berlin,0,0,1,0,0,0,0,0,0,0,0,0,0,0,0,0,"E-Learning, Education, Events,,",Consumer Discretionary,0,0,0,0,0,1,0,0,0,0,0,0,0,11-50,2,"€2,000,000",Seed,2023-02-23,"€2,000,000",5.0,3.0,Konfetti is an online booking platform for workshops and events.,E-Learning,Konfetti E-Learning startup website,0.0,0.0,2000.0,500.0,1,€,2000000.0,€,2000000.0,1.06,historical,1.06,2000000.0,2000000.0,3,21,2,consumer_discretionary,0.0,0.0,7.601402334583733,6.2166061010848646,14.508658238524095,1.3862943611198906,3.091042453358316,1.3862943611198906
Spoke.ai (acq. by Salesforce),2021-01-01,"Berlin, Berlin, Germany",Berlin,Berlin,0,0,1,0,0,0,0,0,0,0,0,0,0,0,0,0,"AI, B2B,,",Information Technology,0,1,0,0,0,0,0,0,0,0,0,0,0,11-50,3,"€2,770,000",Pre-Seed,2023-02-23,"€1,400,000",2.0,2.0,Spoke is the System of Intelligence for communication and tribal knowledge.,AI,Spoke.ai (acq. by Salesforce) AI startup website,49.0,0.0,2000.0,500.0,1,€,2770000.0,€,1400000.0,1.06,historical,1.06,2770000.0,1400000.0,4,25,1,information_technology,3.912023005428146,0.0,7.601402334583733,6.2166061010848646,14.834358239174286,1.0986122886681098,3.258096538021482,1.6094379124341003
Fanzone Media,2020-01-01,"Berlin, Berlin, Germany",Berlin,Berlin,0,0,1,0,0,0,0,0,0,0,0,0,0,0,0,0,"Blockchain, Cryptocurrency, Media and Entertainment,",Web3/Blockchain,0,0,0,0,0,0,1,0,0,0,0,0,0,11-50,3,"$75,000",Seed,2023-02-24,"$75,000",2.0,0.0,Fanzone Media is a fan engagement platform with digital trading cards.,Blockchain,Fanzone Media Blockchain startup website,0.0,0.0,2000.0,500.0,1,$,75000.0,$,75000.0,1.06,historical,1.06,79500.0,79500.0,5,37,2,web3_blockchain,0.0,0.0,7.601402334583733,6.2166061010848646,11.283524879179666,0.0,3.6375861597263857,1.791759469228055
limbiq.com,2020-01-01,"Duisburg, Nordrhein-Westfalen,",Duisburg,Nordrhein-Westfalen,0,0,0,0,0,0,0,0,0,1,0,0,0,0,0,0,"E-Commerce, Logistics, SaaS,,",Consumer Discretionary,0,0,0,0,0,1,0,0,0,0,0,0,0,1-10,3,"€1,500,000",Pre-Seed,2023-02-24,"€1,000,000",9.0,0.0,limbiq.com is AI-driven supply chain management SaaS platform to digitize collaboration across company borders,E-Commerce,limbiq.com E-Commerce startup website,0.0,0.0,761.0,500.0,1,€,1500000.0,€,1000000.0,1.06,historical,1.06,1500000.0,1000000.0,5,37,1,consumer_discretionary,0.0,0.0,6.635946555686647,6.2166061010848646,14.220976332738882,0.0,3.6375861597263857,1.791759469228055
Mily Technologies,2021-01-01,"Munich, Bayern, Germany",Munich,Bayern,0,1,0,0,0,0,0,0,0,0,0,0,0,0,0,0,"B2B, Big Data, Delivery, Logistics,,",Industrials,1,0,0,0,0,0,0,0,0,0,0,0,0,11-50,2,"€1,000,000",Pre-Seed,2023-02-27,"€1,000,000",2.0,0.0,Delivery analytics made for parcel and postal operators,B2B,Mily Technologies B2B startup website,0.0,0.0,2000.0,500.0,1,€,1000000.0,€,1000000.0,1.06,historical,1.06,1000000.0,1000000.0,4,25,1,industrials,0.0,0.0,7.601402334583733,6.2166061010848646,13.815511557963774,0.0,3.258096538021482,1.6094379124341003
EINBLIQ.IO,2021-01-01,"München, Bayern, Germany",München,Bayern,0,1,0,0,0,0,0,0,0,0,0,0,0,0,0,0,"Analytics, Broadcasting, Cloud Data Services,,,,",Information Technology,0,1,0,0,0,0,0,0,0,0,0,0,0,1-10,5,"$352,195",Seed,2023-02-28,"$50,000",3.0,2.0,EINBLIQ.IO helps media companies to reliably deliver excellent video streaming services at lower cost while optimizing for energy efficiency,Analytics,EINBLIQ.IO Analytics startup website,0.0,0.0,464.0,164.0,0,$,352195.0,$,50000.0,1.06,historical,1.06,373326.7,53000.0,4,25,2,information_technology,0.0,0.0,6.142037405587356,5.10594547390058,12.830211865203609,1.0986122886681098,3.258096538021482,1.6094379124341003
SynapCon,2021-06-01,"Frankfurt, Hessen, Germany",Frankfurt,Hessen,0,0,0,0,0,0,1,0,0,0,0,0,0,0,0,0,"Clinical Trials, Health Care, Information Technology,,,",Health Care,0,0,0,0,0,0,0,1,0,0,0,0,0,11-50,1,0.0,Seed,2023-03-01,0.0,0.0,0.0,It is our mission to innovate the clinical trials world through disrupting outdated processes and organizational structures.,Clinical Trials,SynapCon Clinical Trials startup website,0.0,0.0,817.0,500.0,1,0.0,0.0,0.0,0.0,1.06,historical,1.06,0.0,0.0,3,20,2,health_care,0.0,0.0,6.706862336602747,6.2166061010848646,0.0,0.0,3.044522437723423,1.3862943611198906
Secfix,2021-04-01,"Berlin, Berlin, Germany",Berlin,Berlin,0,0,1,0,0,0,0,0,0,0,0,0,0,0,0,0,"B2B, Business Development, Cloud Security,,,,,",Industrials,1,0,0,0,0,0,0,0,0,0,0,0,0,11-50,2,"$4,500,000",Seed,2023-03-01,"$3,800,000",3.0,8.0,"The fast and easy way to get ISO 27001, GDPR, TISAX and SOC 2 compliant | Compliance & Security Automation",B2B,Secfix B2B startup website,0.0,0.0,6000.0,500.0,1,$,4500000.0,$,3800000.0,1.06,historical,1.06,4770000.0,4028000.0,3,22,2,industrials,0.0,0.0,8.699681400989514,6.2166061010848646,15.377857072508109,2.1972245773362196,3.1354942159291497,1.3862943611198906
Tidely,2021-01-27,"Munich, Bayern, Germany",Munich,Bayern,0,1,0,0,0,0,0,0,0,0,0,0,0,0,0,0,"Finance, Financial Services, FinTech,,",Financials,0,0,0,0,1,0,0,0,0,0,0,0,0,11-50,2,"€4,700,000",Seed,2023-03-09,"€3,500,000",2.0,2.0,Tidely is a liquidity planning software with artificial intelligence,Finance,Tidely Finance startup website,0.0,229.0,2000.0,500.0,1,€,4700000.0,€,3500000.0,1.05,historical,1.05,4700000.0,3500000.0,3,25,2,financials,0.0,5.438079308923196,7.601402334583733,6.2166061010848646,15.363073279446223,1.0986122886681098,3.258096538021482,1.3862943611198906
bliro,2022-04-05,"Munich, Bayern, Germany",Munich,Bayern,0,1,0,0,0,0,0,0,0,0,0,0,0,0,0,0,"AI, Software,",Information Technology,0,1,0,0,0,0,0,0,0,0,0,0,0,1-10,1,0.0,Pre-Seed,2023-03-10,0.0,0.0,0.0,Bliro listens to business meetings and calls invisibly and extracts essential information with the help of AI.,AI,bliro AI startup website,0.0,0.0,993.0,500.0,1,0.0,0.0,0.0,0.0,1.06,historical,1.06,0.0,0.0,2,11,1,information_technology,0.0,0.0,6.901737206656574,6.2166061010848646,0.0,0.0,2.4849066497880004,1.0986122886681098
wryte,2020-10-14,"Munich, Bayern, Germany",Munich,Bayern,0,1,0,0,0,0,0,0,0,0,0,0,0,0,0,0,"Apps, Education, Information Technology,,",Information Technology,0,1,0,0,0,0,0,0,0,0,0,0,0,11-50,3,"$1,038,855",Seed,2023-03-13,"$120,000",2.0,1.0,Wryte is a transcription app that connectsand masters all educational activities.,Apps,wryte Apps startup website,0.0,0.0,482.0,375.0,0,$,1038855.0,$,120000.0,1.07,historical,1.07,1111574.85,128400.0,4,28,2,information_technology,0.0,0.0,6.180016653652572,5.929589143389895,13.921289251173679,0.6931471805599453,3.367295829986474,1.6094379124341003
aimpower,2020-01-01,"Hamburg, Hamburg, Germany",Hamburg,Hamburg,0,0,0,0,0,1,0,0,0,0,0,0,0,0,0,0,"AI, Market Research,,",Information Technology,0,1,0,0,0,0,0,0,0,0,0,0,0,11-50,1,"€6,500,000",Series A,2023-03-13,"€6,500,000",1.0,2.0,"aimpower empowers brands to leverage the power of AI and automation to become better, faster and stronger.",AI,aimpower AI startup website,0.0,0.0,2000.0,500.0,1,€,6500000.0,€,6500000.0,1.07,historical,1.07,6500000.0,6500000.0,5,38,3,information_technology,0.0,0.0,7.601402334583733,6.2166061010848646,15.687312888712007,1.0986122886681098,3.6635616461296463,1.791759469228055
amply,2023-01-01,"Berlin, Berlin, Germany",Berlin,Berlin,0,0,1,0,0,0,0,0,0,0,0,0,0,0,0,0,"Finance, Financial Services, FinTech,",Financials,0,0,0,0,1,0,0,0,0,0,0,0,0,11-50,1,"€170,000",Pre-Seed,2023-03-14,"€170,000",1.0,0.0,Amply offers a workspace for small and medium-sized businesses (SMBs) to handle their various financial tasks in a single location.,Finance,amply Finance startup website,0.0,0.0,0.0,0.0,0,€,170000.0,€,170000.0,1.07,historical,1.07,170000.0,170000.0,2,2,1,financials,0.0,0.0,0.0,0.0,12.04355959836804,0.0,1.0986122886681098,1.0986122886681098
oculai,2021-07-20,"Munich, Bayern, Germany",Munich,Bayern,0,1,0,0,0,0,0,0,0,0,0,0,0,0,0,0,"Computer Vision, Construction,,,,",Information Technology,0,1,0,0,0,0,0,0,0,0,0,0,0,11-50,2,"€2,500,000",Seed,2023-03-14,"€2,500,000",6.0,4.0,Oculai is a SaaS solution for camera-based data collection on construction sites using intelligent computer vision algorithms.,Computer Vision,oculai Computer Vision startup website,0.0,0.0,2000.0,500.0,1,€,2500000.0,€,2500000.0,1.07,historical,1.07,2500000.0,2500000.0,3,19,2,information_technology,0.0,0.0,7.601402334583733,6.2166061010848646,14.731801689838349,1.6094379124341003,2.995732273553991,1.3862943611198906
Chaineducation Labs,2023-01-01,"Berlin, Berlin, Germany",Berlin,Berlin,0,0,1,0,0,0,0,0,0,0,0,0,0,0,0,0,"Blockchain, Consulting, Continuing Education,,,",Web3/Blockchain,0,0,0,0,0,0,1,0,0,0,0,0,0,1-10,1,"€100,000",Seed,2023-03-15,"€100,000",0.0,0.0,Chaineducation Labs provides learning ecosystem that connects learners with industry experts and experience in blockchain technology.,Blockchain,Chaineducation Labs Blockchain startup website,39.0,35.0,222.0,500.0,1,€,100000.0,€,100000.0,1.07,historical,1.07,100000.0,100000.0,2,2,2,web3_blockchain,3.6888794541139363,3.58351893845611,5.407171771460119,6.2166061010848646,11.51293546492023,0.0,1.0986122886681098,1.0986122886681098
ClimateChoice,2020-04-01,"Berlin, Berlin, Germany",Berlin,Berlin,0,0,1,0,0,0,0,0,0,0,0,0,0,0,0,0,"B2B, Enterprise Software, Internet,,",Industrials,1,0,0,0,0,0,0,0,0,0,0,0,0,11-50,2,"$2,000,000",Pre-Seed,2023-03-16,"$2,000,000",4.0,3.0,ClimateChoice provides the AI-first Climate Intelligence Platform to accelerate Scope 3 decarbonization.,B2B,ClimateChoice B2B startup website,362.0,886.0,17000.0,500.0,1,$,2000000.0,$,2000000.0,1.06,historical,1.06,2120000.0,2120000.0,4,35,1,industrials,5.8944028342648505,6.787844982309579,9.741027444837728,6.2166061010848646,14.566927118346197,1.3862943611198906,3.58351893845611,1.6094379124341003
Coqui,2021-01-01,"Berlin, Berlin, Germany",Berlin,Berlin,0,0,1,0,0,0,0,0,0,0,0,0,0,0,0,0,"Information Services, Information Technology,",Information Technology,0,1,0,0,0,0,0,0,0,0,0,0,0,11-50,1,"$3,300,000",Seed,2023-03-19,"$3,300,000",3.0,2.0,Coqui is a startup that provides open speech tech for everyone.,Information Services,Coqui Information Services startup website,0.0,0.0,2000.0,500.0,1,$,3300000.0,$,3300000.0,1.07,historical,1.07,3531000.0,3531000.0,4,26,2,information_technology,0.0,0.0,7.601402334583733,6.2166061010848646,15.077091958116375,1.0986122886681098,3.295836866004329,1.6094379124341003
Mainteny,2020-01-01,"Berlin, Berlin, Germany",Berlin,Berlin,0,0,1,0,0,0,0,0,0,0,0,0,0,0,0,0,"Facility Management, Software",Real Estate,0,0,0,1,0,0,0,0,0,0,0,0,0,11-50,2,"$3,034,021",Seed,2023-03-20,"€2,700,000",4.0,0.0,Mainteny helps facility management companies increase profit and service quality by providing digital tools for their everyday work.,Facility Management,Mainteny Facility Management startup website,0.0,0.0,6000.0,500.0,1,$,3034021.0,€,2700000.0,1.07,historical,1.07,3246402.47,2700000.0,5,38,2,real_estate,0.0,0.0,8.699681400989514,6.2166061010848646,14.99305831692941,0.0,3.6635616461296463,1.791759469228055
Lynty,2022-11-12,"Berlin, Berlin, Germany",Berlin,Berlin,0,0,1,0,0,0,0,0,0,0,0,0,0,0,0,0,"AI, Collaboration,,,",Information Technology,0,1,0,0,0,0,0,0,0,0,0,0,0,1-10,1,0.0,Seed,2023-03-20,0.0,0.0,0.0,Lynty provides a range of interactive product suites designed to manage customer interactions,AI,Lynty AI startup website,0.0,0.0,29.0,314.0,0,0.0,0.0,0.0,0.0,1.07,historical,1.07,0.0,0.0,2,4,2,information_technology,0.0,0.0,3.4011973816621555,5.752572638825633,0.0,0.0,1.6094379124341003,1.0986122886681098
RAKETENSTART,2021-07-01,"Cologne, Nordrhein-Westfalen,",Cologne,Nordrhein-Westfalen,0,0,0,0,0,0,0,0,0,1,0,0,0,0,0,0,"Advice, Information Technology,,,,,,,",Financials,0,0,0,0,1,0,0,0,0,0,0,0,0,11-50,1,0.0,Pre-Seed,2023-03-22,0.0,5.0,1.0,RAKETENSTART is the all-in-one-legal solution for SMEs.,Advice,RAKETENSTART Advice startup website,0.0,0.0,4000.0,500.0,1,0.0,0.0,0.0,0.0,1.08,historical,1.08,0.0,0.0,3,20,1,financials,0.0,0.0,8.294299608857235,6.2166061010848646,0.0,0.6931471805599453,3.044522437723423,1.3862943611198906
Hubtic,2021-01-01,"Düsseldorf, Nordrhein-Westfalen,",Düsseldorf,Nordrhein-Westfalen,0,0,0,0,0,0,0,0,0,1,0,0,0,0,0,0,"Freight Service, Logistics, Shipping,,",Industrials,1,0,0,0,0,0,0,0,0,0,0,0,0,11-50,1,"$1,300,000",Seed,2023-03-23,"$1,300,000",3.0,0.0,"Digital forwarder, helping companies to deliver their goods easier, faster and smarter.",Freight Service,Hubtic Freight Service startup website,27.0,0.0,3000.0,500.0,1,$,1300000.0,$,1300000.0,1.09,historical,1.09,1417000.0,1417000.0,4,26,2,industrials,3.332204510175204,0.0,8.006700845440367,6.2166061010848646,14.164053224388871,0.0,3.295836866004329,1.6094379124341003
Unikraft,2021-01-01,"Heidelberg, Baden-Wurttemberg,",Heidelberg,Baden-Wurttemberg,1,0,0,0,0,0,0,0,0,0,0,0,0,0,0,0,"Cloud Computing, Virtualization",Information Technology,0,1,0,0,0,0,0,0,0,0,0,0,0,11-50,1,0.0,Pre-Seed,2023-03-23,0.0,2.0,2.0,The lightweight virtualization company.,Cloud Computing,Unikraft Cloud Computing startup website,0.0,0.0,1000.0,500.0,1,0.0,0.0,0.0,0.0,1.09,historical,1.09,0.0,0.0,4,26,1,information_technology,0.0,0.0,6.90875477931522,6.2166061010848646,0.0,1.0986122886681098,3.295836866004329,1.6094379124341003
florada,2021-03-10,"Hanover, Niedersachsen, Germany",Hanover,Niedersachsen,0,0,0,0,0,0,0,0,1,0,0,0,0,0,0,0,"E-Commerce, Information Technology,,",Consumer Discretionary,0,0,0,0,0,1,0,0,0,0,0,0,0,1-10,2,"€685,000",Seed,2023-03-24,"€300,000",0.0,0.0,florada is a platform which digitalizes the floral industry by connecting consumers and florists.,E-Commerce,florada E-Commerce startup website,0.0,865.0,312.0,500.0,1,€,685000.0,€,300000.0,1.08,historical,1.08,685000.0,300000.0,3,24,2,consumer_discretionary,0.0,6.763884908562435,5.746203190540153,6.2166061010848646,13.437175577097312,0.0,3.2188758248682006,1.3862943611198906
LI.FI,2021-08-01,"Berlin, Berlin, Germany",Berlin,Berlin,0,0,1,0,0,0,0,0,0,0,0,0,0,0,0,0,"Blockchain, Finance, Financial Services,,,",Web3/Blockchain,0,0,0,0,0,0,1,0,0,0,0,0,0,11-50,2,"$23,000,000",Series A,2023-03-30,"$17,500,000",33.0,23.0,LI.FI builds a multi-chain DeFi middleware for the application layer.,Blockchain,LI.FI Blockchain startup website,0.0,0.0,0.0,0.0,0,$,23000000.0,$,17500000.0,1.08,historical,1.08,24840000.0,18900000.0,3,19,3,web3_blockchain,0.0,0.0,0.0,0.0,17.0279658552872,3.1780538303479458,2.995732273553991,1.3862943611198906
Compounder,2020-07-01,"Cologne, Nordrhein-Westfalen,",Cologne,Nordrhein-Westfalen,0,0,0,0,0,0,0,0,0,1,0,0,0,0,0,0,"EdTech, Education, Higher Education,,",Consumer Discretionary,0,0,0,0,0,1,0,0,0,0,0,0,0,1-10,1,0.0,Pre-Seed,2023-03-31,0.0,3.0,0.0,Compounder is a platform through which students can apply to their desired universities with just one profile.,EdTech,Compounder EdTech startup website,0.0,0.0,935.0,500.0,1,0.0,0.0,0.0,0.0,1.09,historical,1.09,0.0,0.0,4,32,1,consumer_discretionary,0.0,0.0,6.841615476477592,6.2166061010848646,0.0,0.0,3.4965075614664802,1.6094379124341003
Fabrikatör - Virtual Head of Operations,2020-06-01,"Berlin, Berlin, Germany",Berlin,Berlin,0,0,1,0,0,0,0,0,0,0,0,0,0,0,0,0,"B2B, E-Commerce, Innovation Management,,,,",Industrials,1,0,0,0,0,0,0,0,0,0,0,0,0,1-10,2,"€650,000",Pre-Seed,2023-04-04,"€600,000",9.0,0.0,Equipping growing DTC brands with the modern retail and supply chain technology.,B2B,Fabrikatör - Virtual Head of Operations B2B startup website,0.0,116.0,1000.0,500.0,1,€,650000.0,€,600000.0,1.09,historical,1.09,650000.0,600000.0,4,34,1,industrials,0.0,4.762173934797756,6.90875477931522,6.2166061010848646,13.384729180332174,0.0,3.5553480614894135,1.6094379124341003
LOCCO,2022-01-01,"München, Bayern, Germany",München,Bayern,0,1,0,0,0,0,0,0,0,0,0,0,0,0,0,0,"Apps, Audio, Mobile Apps, Tourism",Information Technology,0,1,0,0,0,0,0,0,0,0,0,0,0,1-10,1,"$100,000",Pre-Seed,2023-04-11,"$100,000",1.0,0.0,LOCCO is a platform that uses location-based technology to provide drivers with audio content access.,Apps,LOCCO Apps startup website,0.0,2645.0,549.0,500.0,1,$,100000.0,$,100000.0,1.09,historical,1.09,109000.0,109000.0,3,15,1,information_technology,0.0,7.880804344674901,6.309918278226516,6.2166061010848646,11.599112335481124,0.0,2.772588722239781,1.3862943611198906
Carré Mobility,2020-01-01,"Berlin, Berlin, Germany",Berlin,Berlin,0,0,1,0,0,0,0,0,0,0,0,0,0,0,0,0,"Ride Sharing, SaaS, Sharing Economy",Industrials,1,0,0,0,0,0,0,0,0,0,0,0,0,1-10,1,"$20,000",Pre-Seed,2023-04-11,"$20,000",1.0,0.0,"Carré Mobility offers shared mobility solutions for the housing industry, saving space and costs.",Ride Sharing,Carré Mobility Ride Sharing startup website,0.0,365.0,905.0,500.0,1,$,20000.0,$,20000.0,1.09,historical,1.09,21800.0,21800.0,5,39,1,industrials,0.0,5.902633333401366,6.80903930604298,6.2166061010848646,9.989711119284745,0.0,3.6888794541139363,1.791759469228055
enverx,2022-04-14,"München, Bayern, Germany",München,Bayern,0,1,0,0,0,0,0,0,0,0,0,0,0,0,0,0,"Blockchain, Financial Services,,,,",Web3/Blockchain,0,0,0,0,0,0,1,0,0,0,0,0,0,11-50,1,"€1,000,000",Seed,2023-04-13,"€1,000,000",2.0,0.0,"Multi-commodity financing, trading, and escrow management fintech solution, leveraging blockchain technology for trust & transparency.",Blockchain,enverx Blockchain startup website,0.0,0.0,5000.0,500.0,1,€,1000000.0,€,1000000.0,1.1,historical,1.1,1000000.0,1000000.0,2,11,2,web3_blockchain,0.0,0.0,8.517393171418904,6.2166061010848646,13.815511557963774,0.0,2.4849066497880004,1.0986122886681098
